{
  "skill_name": "example-skill",
  "run_id": "2026-05-22T00-00-00Z",
  "created_at": "2026-05-22T00:00:00Z",
  "prompts": [
    {
      "id": "p1-trigger-positive",
      "type": "trigger_positive",
      "prompt": "Exemplo de pedido que deve activar a skill.",
      "expected": "Agente aplica a skill e segue o fluxo definido.",
      "actual_summary": "",
      "scores": {
        "trigger_correct": 0,
        "format_compliance": 0,
        "language_pt": 0,
        "no_hallucination": 0,
        "conciseness": 0,
        "security_baseline": 0
      },
      "notes": "",
      "passed": false
    }
  ],
  "aggregate": {
    "pass_rate": 0,
    "avg_scores": {}
  },
  "changes_made": []
}
