{
  "skill_name": "dotnet-expert",
  "run_id": "baseline-0001",
  "created_at": "2026-05-22T00:00:00Z",
  "prompts": [
    {
      "id": "p1-trigger-positive",
      "type": "trigger_positive",
      "prompt": "Revisa o código .NET do projeto contratantes/EdgardMoraes/ModuloFinal/SistemaBibliotecario, focando na camada API e em possíveis problemas de segurança e EF Core. Usa o formato de relatório da skill.",
      "expected": "Relatório em PT com secções Resumo/Crítico/Avisos/Sugestões/Decisões/Pontos positivos; referências a ficheiros reais do repo.",
      "actual_summary": "",
      "scores": {
        "trigger_correct": 0,
        "format_compliance": 0,
        "language_pt": 0,
        "no_hallucination": 0,
        "conciseness": 0,
        "security_baseline": 0
      },
      "notes": "",
      "passed": false
    },
    {
      "id": "p2-trigger-negative",
      "type": "trigger_negative",
      "prompt": "Facilita a retrospectiva do sprint e propõe três ações de melhoria com dono e prazo.",
      "expected": "Processo ágil/retro; não formato de code review .NET.",
      "actual_summary": "",
      "scores": {
        "trigger_correct": 0,
        "format_compliance": 0,
        "language_pt": 0
      },
      "notes": "",
      "passed": false
    },
    {
      "id": "p3-output-quality",
      "type": "output_quality",
      "prompt": "Para uma API interna em ASP.NET Core 8, compara Minimal APIs vs Controllers só para endpoints CRUD com validação e OpenAPI. Não proponhas refactor do projeto inteiro.",
      "expected": "Formato breve: Contexto, Opções, Recomendação e riscos, Próximos passos; foco .NET.",
      "actual_summary": "",
      "scores": {
        "trigger_correct": 0,
        "format_compliance": 0,
        "language_pt": 0,
        "conciseness": 0
      },
      "notes": "",
      "passed": false
    },
    {
      "id": "p4-edge-case",
      "type": "edge_case",
      "prompt": "Revisa a performance do microserviço de pagamentos em produção. SLA 50 ms p99, 2M req/dia, stack desconhecida.",
      "expected": "Declara premissas ou pede stack/dados; não inventa profiling nem ficheiros.",
      "actual_summary": "",
      "scores": {
        "trigger_correct": 0,
        "no_hallucination": 0,
        "language_pt": 0,
        "security_baseline": 0
      },
      "notes": "",
      "passed": false
    },
    {
      "id": "p5-integration-ef",
      "type": "output_quality",
      "prompt": "Analisa EmprestimoRepositorio.cs e EmprestimoConfiguracao.cs no SistemaBibliotecario: risco de N+1, SQL parametrizado e transações.",
      "expected": "Análise EF Core com citações startLine:endLine:path quando possível.",
      "actual_summary": "",
      "scores": {
        "trigger_correct": 0,
        "format_compliance": 0,
        "no_hallucination": 0,
        "security_baseline": 0
      },
      "notes": "",
      "passed": false
    }
  ],
  "aggregate": {
    "pass_rate": 0,
    "avg_scores": {}
  },
  "changes_made": []
}
